{
  "_slim": {
    "version": "2.1",
    "level": 3,
    "contentType": "documentation",
    "generatedAt": "2026-02-07T14:30:00Z",
    "sourceHash": "sha256:a1b2c3d4e5f6789012345678901234567890abcdef",
    "tokenCount": 187,
    "availableLevels": [1, 2, 3, 4, 5, 7],
    "ttlSeconds": 3600
  },
  "capabilities": ["query", "summarize", "navigate", "cite", "extract"],
  "contentType": "documentation",
  "title": "Getting Started with SLIM-PYRAMID",
  "language": "en",
  "length": {
    "value": 12,
    "unit": "pages"
  },
  "createdAt": "2026-02-01T10:00:00Z",
  "author": "SLIM Protocol Team",
  "description": "A comprehensive guide to implementing the SLIM-PYRAMID protocol in your AI applications.",
  "outline": [
    {
      "id": "s1",
      "title": "Introduction",
      "level": 1,
      "children": [
        { "id": "s1.1", "title": "What is SLIM-PYRAMID?", "level": 2 },
        { "id": "s1.2", "title": "Key Benefits", "level": 2 }
      ]
    },
    {
      "id": "s2",
      "title": "Quick Start",
      "level": 1,
      "children": [
        { "id": "s2.1", "title": "Installation", "level": 2 },
        { "id": "s2.2", "title": "Basic Usage", "level": 2 }
      ]
    },
    {
      "id": "s3",
      "title": "The 10 Levels",
      "level": 1
    },
    {
      "id": "s4",
      "title": "Best Practices",
      "level": 1
    }
  ],
  "units": [
    { "id": "u1", "type": "section", "parentId": "s1", "tokenEstimate": 150, "preview": "SLIM-PYRAMID is a protocol for..." },
    { "id": "u2", "type": "section", "parentId": "s1.1", "tokenEstimate": 200 },
    { "id": "u3", "type": "section", "parentId": "s1.2", "tokenEstimate": 180 },
    { "id": "u4", "type": "section", "parentId": "s2.1", "tokenEstimate": 120 },
    { "id": "u5", "type": "figure", "parentId": "s2.2", "tokenEstimate": 50 },
    { "id": "u6", "type": "table", "parentId": "s3", "tokenEstimate": 300 },
    { "id": "u7", "type": "section", "parentId": "s4", "tokenEstimate": 250 }
  ],
  "topics": [
    "progressive disclosure",
    "token optimization",
    "AI agents",
    "content representation",
    "TypeScript"
  ],
  "entities": [
    { "name": "SLIM-PYRAMID", "type": "technology", "mentions": 45 },
    { "name": "TypeScript", "type": "technology", "mentions": 12 },
    { "name": "JSON", "type": "technology", "mentions": 8 },
    { "name": "HTTP", "type": "technology", "mentions": 6 }
  ]
}
